[
  {
    "musicId": 11475,
    "difficulty": "master",
    "id": "f613a23a-fcd8-4767-94e3-cbaaf469c47d",
    "name": "S2",
    "startMs": 107000,
    "endMs": 127000
  },
  {
    "musicId": 11475,
    "difficulty": "master",
    "id": "170918a2-daa5-4dfe-84b4-7a759563d88d",
    "name": "S3",
    "startMs": 127000,
    "endMs": 138000
  }
]
