[
  {
    "musicId": 417,
    "difficulty": "master",
    "id": "ecdd9399-33ec-4225-a4a3-f50f9b58cb46",
    "name": "S1",
    "startMs": 60000,
    "endMs": 76000
  },
  {
    "musicId": 417,
    "difficulty": "master",
    "id": "8e042439-c118-43f2-b433-4b384c52376e",
    "name": "S2",
    "startMs": 104000,
    "endMs": 115000
  },
  {
    "musicId": 417,
    "difficulty": "master",
    "id": "a7949854-cee2-4073-9744-a46e3751d799",
    "name": "Final",
    "startMs": 120000,
    "endMs": 128000
  }
]
